<?xml version="1.0" encoding="utf-8" ?>
<TestSuite xmlns="http://arctisaurora/AuroraTestTypes"
		  xmlns:xsi="http://www.w3.org/2001/XMLSchema-instance"
		  xsi:schemaLocation="http://arctisaurora/AuroraTestTypes ../../Schemas/TestTypeSchema.xsd" >
	<Test Action="TextInput.TypeWritesText"/>
	<Test Action="TextInput.WordMoves"/>
	<Test Action="TextInput.UndoReselects"/>
	<Test Action="TextInput.PasteRoundTrip"/>
	<Test Action="TextInput.PastePlainLines"/>
	<Test Action="TextInput.FieldClipboardAndUndo"/>
	<Test Action="TextInput.FieldWordAndScroll"/>
	<Test Action="RegexText.LinesAndCommit"/>
	<Test Action="RegexText.WrapMoves"/>
	<Test Action="RegexText.CommaPattern"/>
	<Test Action="TextInput.DragMovesText"/>
	<Test Action="TextInput.DropOntoRule"/>
	<Test Action="TextInput.DragBetweenNotes"/>
	<Test Action="TextInput.WheelZoom"/>
	<Test Action="TextInput.RightModifiers"/>
	<Test Action="TextInput.StyleSurvivesEnterAndBackspace"/>
	<Test Action="TextInput.UnderlineToggles"/>
	<Test Action="TextInput.MixedSelectionToggles"/>
	<Test Action="TextInput.HighlightApplies"/>
	<Test Action="TextInput.DecorationsDraw"/>
	<Test Action="TextInput.ColorPickerPicks"/>
	<Test Action="TextInput.MarkdownColourRoundTrip"/>
	<Test Action="TextInput.ListMarkersPerList"/>
	<Test Action="TextInput.EmptyItemEnterOutdents"/>
	<Test Action="TextInput.ListMarkersDraw"/>
	<Test Action="TextInput.TableEnterAddsLine"/>
	<Test Action="TextInput.TableTabStepsCells"/>
	<Test Action="TextInput.TableLeftCrossesCells"/>
	<Test Action="TextInput.TableBackspaceKeepsCells"/>
	<Test Action="TextInput.TableWideScrolls"/>
	<Test Action="TextInput.TableXmlRoundTrip"/>
	<Test Action="TextInput.TableDraws"/>
	<Test Action="TextInput.TableOverflowDraws"/>
	<Test Action="TextInput.TableWheelAxes"/>
	<Test Action="TextInput.TableSplitsAcrossPages"/>
	<Test Action="TextInput.TableInsertUndo"/>
	<Test Action="TextInput.TableInsertRefusedInMarkdown"/>
	<Test Action="TextInput.TableRowsAndColumns"/>
	<Test Action="TextInput.TableTabAddsRow"/>
	<Test Action="TextInput.TableListInCell"/>
	<Test Action="TextInput.TableResizeColumn"/>
	<Test Action="TextInput.TableColumnSpan"/>
	<Test Action="TextInput.TableRules"/>
	<Test Action="TextInput.CodeColoursAndOverflow"/>
	<Test Action="TextInput.PictureEditUndo"/>
	<Test Action="TextInput.PictureRoundTrip"/>
	<Test Action="TextInput.PictureResize"/>
	<Test Action="TextInput.PictureHandlesDraw"/>
	<Test Action="TextInput.PictureWrapLayout"/>
	<Test Action="TextInput.PictureFloatEdit"/>
	<Test Action="TextInput.PictureWrapDraws"/>
	<Test Action="TextInput.PictureTightLayout"/>
	<Test Action="TextInput.PictureFloatMove"/>
	<Test Action="TextInput.PictureTightDraws"/>
	<Test Action="TextInput.PictureRotateRoundTrip"/>
	<Test Action="TextInput.PictureRotateInline"/>
	<Test Action="TextInput.PictureRotateLayout"/>
	<Test Action="TextInput.PictureRotateDraws"/>
	<Test Action="TextInput.PictureRotate"/>
	<Test Action="TextInput.PictureInline"/>
	<Test Action="TextInput.MarkdownPrefixes"/>
	<Test Action="TextInput.MarkdownInline"/>
	<Test Action="TextInput.CodeBlockEditing"/>
	<Test Action="TextInput.RuleEditing"/>
	<Test Action="TextInput.MarkdownBlocksRoundTrip"/>
	<Test Action="TextInput.MarkdownSkipsPlainText"/>
	<Test Action="TextInput.AlignLines"/>
	<Test Action="TextInput.JustifyLines"/>
	<Test Action="TextInput.PageNumbersAndUndo"/>
	<Test Action="TextInput.AlignAroundPicture"/>
	<Test Action="TextInput.MarkdownBlocksDraw"/>
	<Test Action="TextInput.MarkdownFences"/>
	<Test Action="TextInput.CodeBlockTab"/>
	<Test Action="TextInput.MarkdownFancyLists"/>
	<Test Action="TextInput.ListStartNumbers"/>
	<Test Action="TextInput.HeaderFieldTakesPress"/>
	<Test Action="TextInput.ViewStateRoundTrip"/>
	<Test Action="TextInput.FrontmatterKeys"/>
	<Test Action="TextInput.TabStops"/>
	<Test Action="TextInput.SessionScopeSwap"/>
	<Test Action="TextInput.ReadOnlyRefusesEdits"/>
	<Test Action="TextInput.MathRoundTrip"/>
	<Test Action="TextInput.MathLineBox"/>
	<Test Action="TextInput.MathCopyText"/>
	<Test Action="TextInput.MathDraws"/>
	<Test Action="TextInput.MathArrays"/>
	<Test Action="TextInput.MathInsertCommit"/>
	<Test Action="TextInput.MathInsertCancel"/>
	<Test Action="TextInput.MathEditUndo"/>
	<Test Action="TextInput.MathLivePreview"/>
	<Test Action="TextInput.MathEscReverts"/>
	<Test Action="TextInput.MathClickSelects"/>
	<Test Action="TextInput.MathDoubleClickOpens"/>
	<Test Action="Tex.SourceEnterPaste"/>
	<Test Action="Tex.SourceColours"/>
</TestSuite>
