<?xml version="1.0" encoding="utf-8" ?>
<TestSuite xmlns="http://arctisaurora/AuroraTestTypes"
		  xmlns:xsi="http://www.w3.org/2001/XMLSchema-instance"
		  xsi:schemaLocation="http://arctisaurora/AuroraTestTypes ../../Schemas/TestTypeSchema.xsd" >
	<Test Action="LatinModern.Baked"/>
	<Test Action="LatinModern.Draws"/>
	<Test Action="Tex.Preview"/>
	<Test Action="Tex.Floats"/>
	<Test Action="Tex.SplitView.Recompile"/>
	<Test Action="Tex.SplitView.Errors"/>
	<Test Action="Tex.SplitView.ClickToSource"/>
</TestSuite>
