<?xml version="1.0" encoding="utf-8" ?>
<TestSuite xmlns="http://arctisaurora/AuroraTestTypes"
		  xmlns:xsi="http://www.w3.org/2001/XMLSchema-instance"
		  xsi:schemaLocation="http://arctisaurora/AuroraTestTypes ../../Schemas/TestTypeSchema.xsd" >
	<Test Action="Ribbon.Shows"/>
	<Test Action="Ribbon.Docs"/>
	<Test Action="Ribbon.Sheets"/>
	<Test Action="Inspector.Docs"/>
	<Test Action="Inspector.Sheets"/>
	<Test Action="Ribbon.Session"/>
	<Test Action="Note.NumbersToggle"/>
	<Test Action="Note.TasksToggle"/>
	<Test Action="Note.InsertPictureFile"/>
	<Test Action="Sheet.ImportCsv"/>
	<Test Action="Ribbon.CsvEntries"/>
</TestSuite>
