<?xml version="1.0" encoding="utf-8" ?>
<TestSuite xmlns="http://arctisaurora/AuroraTestTypes"
		  xmlns:xsi="http://www.w3.org/2001/XMLSchema-instance"
		  xsi:schemaLocation="http://arctisaurora/AuroraTestTypes ../../Schemas/TestTypeSchema.xsd" >
	<Test Action="Workspace.Switch"/>
	<Test Action="Workspace.Menu"/>
	<Test Action="Workspace.SessionRoundTrip"/>
	<Test Action="Workspace.LegacySession"/>
	<Test Action="Workspace.Reorder"/>
	<Test Action="Workspace.MoveAcross"/>
	<Test Action="Workspace.TearOff"/>
	<Test Action="Workspace.Reset"/>
</TestSuite>
