<?xml version="1.0" encoding="utf-8" ?>
<TestSuite xmlns="http://arctisaurora/AuroraTestTypes"
		  xmlns:xsi="http://www.w3.org/2001/XMLSchema-instance"
		  xsi:schemaLocation="http://arctisaurora/AuroraTestTypes ../../Schemas/TestTypeSchema.xsd" >
	<Test Action="Planner.XmlRoundTrip"/>
	<Test Action="Planner.GanttGeometry"/>
	<Test Action="Planner.BoardColumns"/>
	<Test Action="Planner.ViewState"/>
	<Test Action="Planner.DragMoveUndo"/>
	<Test Action="Planner.DragResize"/>
	<Test Action="Planner.EditAddDelete"/>
	<Test Action="Planner.DeleteKeys"/>
	<Test Action="Planner.SaveKey"/>
	<Test Action="Planner.PopupCategory"/>
	<Test Action="Planner.MenuMove"/>	<Test Action="Planner.GanttGolden"/>
	<Test Action="Planner.BoardDragAcross"/>
	<Test Action="Planner.BoardDragWithin"/>
	<Test Action="Planner.BoardGolden"/>
	<Test Action="Planner.CategoryEdits"/>
	<Test Action="Planner.CategoryPopup"/>
	<Test Action="Planner.AssigneeGolden"/>
	<Test Action="Planner.CalendarPack"/>
	<Test Action="Planner.CalendarGeometry"/>
	<Test Action="Planner.CalendarSnap"/>
	<Test Action="Planner.WeekStart"/>
	<Test Action="Planner.CalendarDragUndo"/>
	<Test Action="Planner.CalendarCreate"/>
	<Test Action="Planner.CalendarMonth"/>
	<Test Action="Planner.CalendarGolden"/>
	<Test Action="Planner.FollowersMove"/>
	<Test Action="Planner.FollowCycle"/>
	<Test Action="Planner.AttachmentText"/>
	<Test Action="Planner.Description"/>
	<Test Action="Planner.ExpandBoard"/>
	<Test Action="Planner.ExpandGantt"/>
	<Test Action="Planner.ExpandCalendar"/>
	<Test Action="Planner.AttachmentGolden"/>
	<Test Action="Planner.TwoViews"/>
	<Test Action="Planner.WheelZoom"/>
</TestSuite>
